{
  "record_type": "evolution_policy",
  "schema_version": "2.0.0-alpha.1",
  "mode": "machine_only",
  "provenance": {
    "taxonomy": {
      "name": "中文虚构对话失败图谱",
      "version": "2.0.0-alpha.2",
      "digest": "3de6c3ff814a2e33914f072ff52a0bec0572c97f52e261b76268e1cf654d779b",
      "uri": "../../taxonomy.json"
    },
    "schema": {
      "id": "https://yuqing-cai.github.io/cn-failure-atlas/schemas/evolution-policy.schema.json",
      "version": "2.0.0-alpha.1",
      "digest": "e04f7d58888bd510b5f92fd336ccfcddb2d9b0c9620b2d8a8c9c5069cf2426f4"
    },
    "runner": {
      "name": "atlas-machine-loop",
      "version": "0.1.0",
      "commit": "1a2b3c4"
    },
    "prompt_bundle": {
      "id": "prompt.policy-execution.v1",
      "version": "1.0.0",
      "digest": "1212121212121212121212121212121212121212121212121212121212121212"
    },
    "digest_status": "example_placeholder",
    "created_at": "2026-08-24T09:55:00Z"
  },
  "policy_digest": "ef930658085797b3a5ac4944c3b50b75f97fb8598225169f04f488c1c2b3fc1c",
  "policy": {
    "id": "policy.machine-only.v1",
    "version": "2.0.0-alpha.1",
    "status": "promoted",
    "thresholds": {
      "min_independent_judges": 2,
      "min_evidence_coverage": 0.9,
      "min_counterfactual_pass_rate": 0.9,
      "max_regression_failure_rate": 0.05,
      "min_repeat_runs": 2
    },
    "prohibit_generator_as_judge": true,
    "require_order_swap": true,
    "require_candidate_preferred": true,
    "require_blind_candidate_identity": true,
    "require_blind_model_identity": true,
    "require_no_unresolved_blocking_challenges": true,
    "promotion_targets": [
      "repair_case"
    ]
  },
  "actor_isolation": {
    "logical_roles": [
      "generator",
      "contract_critic",
      "critic",
      "test_judge",
      "repairer",
      "judge",
      "aggregator",
      "policy_executor"
    ],
    "required_pair_boundaries": [
      "generator_critic",
      "generator_repairer",
      "diagnostic_repairer",
      "generator_judge",
      "repairer_judge",
      "judge_aggregator",
      "critic_judge",
      "preference_judge_audit_judge"
    ],
    "accepted_mechanisms": [
      "separate_context",
      "separate_prompt",
      "fresh_seed",
      "blinded_candidate_identity",
      "no_shared_scratchpad"
    ],
    "same_model_weights_allowed": true,
    "origin_diversity_preferred": true
  },
  "verification_protocol": {
    "pairwise_blind_comparison": true,
    "orders": [
      "AB",
      "BA"
    ],
    "reset_context_between_orders": true,
    "counterfactual_suite_required": true,
    "regression_suite_required": true,
    "evidence_trace_required": true,
    "challenge_round_required": true,
    "promotion_artifact_binding_required": true,
    "frozen_evaluation_manifest_required": true,
    "exact_manifest_coverage_required": true,
    "experiment_ledger_required": true,
    "inconclusive_is_not_promotion": true
  },
  "promotion_lifecycle": {
    "states": [
      "generated",
      "diagnosed",
      "challenged",
      "repair_proposed",
      "verifying",
      "probation",
      "promoted",
      "rejected",
      "quarantined",
      "deprecated",
      "rolled_back"
    ],
    "hard_gates": [
      "schema_bundle_valid",
      "provenance_verified",
      "trust_root_pinned",
      "taxonomy_authority_pinned",
      "run_attestation_verified",
      "source_records_content_addressed",
      "actor_profiles_bound",
      "target_failure_reduced",
      "aggregation_recomputed",
      "generator_not_judge",
      "order_swap_complete",
      "independent_judges_met",
      "evidence_coverage_met",
      "counterfactual_pass_rate_met",
      "regression_failure_rate_met",
      "repeat_runs_met",
      "no_unresolved_blocking_challenges",
      "candidate_wins",
      "policy_digest_bound",
      "promotion_artifact_bound",
      "evaluation_manifest_complete",
      "experiment_budget_respected",
      "taxonomy_test_recipe_replayed",
      "scene_contract_grounded",
      "generation_request_precommitted",
      "diagnostic_request_precommitted",
      "repair_request_precommitted",
      "verification_request_precommitted",
      "repair_targets_evidence_bound",
      "actor_ids_unique",
      "preference_audit_channels_isolated",
      "target_judge_cartesian_coverage",
      "critic_handoff_complete",
      "receipt_timeline_valid",
      "blinding_mapping_committed",
      "repeat_contexts_isolated",
      "repair_edits_replayed",
      "preservation_checks_bound",
      "stop_rule_trigger_consistent",
      "target_turn_bound",
      "cross_stage_actor_isolation",
      "taxonomy_semantics_valid",
      "regression_registry_pinned",
      "preference_requests_bound",
      "challenge_invocations_bound",
      "counterfactual_sources_bound",
      "evidence_support_set_complete",
      "verification_suites_bound",
      "structural_input_limits_enforced",
      "audit_requests_bound",
      "lifecycle_graph_frozen",
      "model_call_lower_bound_enforced",
      "verification_timestamps_ordered",
      "challenge_requests_bound",
      "challenge_resolution_checks_exact",
      "case_scoped_promotion_only",
      "model_call_ledger_cumulative"
    ],
    "transitions": [
      {
        "from": "generated",
        "to": "diagnosed",
        "condition_code": "diagnostic_bundle_valid"
      },
      {
        "from": "generated",
        "to": "quarantined",
        "condition_code": "diagnostic_bundle_invalid"
      },
      {
        "from": "diagnosed",
        "to": "challenged",
        "condition_code": "diagnostic_challenge_required"
      },
      {
        "from": "diagnosed",
        "to": "quarantined",
        "condition_code": "diagnostic_evidence_inconclusive"
      },
      {
        "from": "challenged",
        "to": "repair_proposed",
        "condition_code": "diagnostic_challenge_resolved"
      },
      {
        "from": "challenged",
        "to": "quarantined",
        "condition_code": "diagnostic_challenge_unresolved"
      },
      {
        "from": "repair_proposed",
        "to": "verifying",
        "condition_code": "verification_request_precommitted"
      },
      {
        "from": "repair_proposed",
        "to": "rejected",
        "condition_code": "repair_critic_rejected"
      },
      {
        "from": "verifying",
        "to": "rejected",
        "condition_code": "gate_rejected"
      },
      {
        "from": "verifying",
        "to": "quarantined",
        "condition_code": "gate_inconclusive"
      },
      {
        "from": "verifying",
        "to": "probation",
        "condition_code": "gate_candidate"
      },
      {
        "from": "verifying",
        "to": "promoted",
        "condition_code": "gate_adopted"
      },
      {
        "from": "probation",
        "to": "rejected",
        "condition_code": "fresh_batch_gate_rejected"
      },
      {
        "from": "probation",
        "to": "quarantined",
        "condition_code": "fresh_batch_gate_inconclusive"
      },
      {
        "from": "probation",
        "to": "promoted",
        "condition_code": "fresh_batch_gate_adopted"
      },
      {
        "from": "promoted",
        "to": "rolled_back",
        "condition_code": "new_blocking_regression"
      },
      {
        "from": "promoted",
        "to": "deprecated",
        "condition_code": "superseded_by_promoted_artifact"
      }
    ],
    "taxonomy_change_scope": {
      "direct_mutation_allowed": false,
      "proposal_required": true,
      "version_bump_required": true,
      "revalidate_prior_anchors": true
    }
  },
  "rollback_policy": {
    "retain_all_artifacts": true,
    "rollback_on_new_blocking_regression": true,
    "rollback_on_gate_recalculation_failure": true,
    "quarantine_failed_strategy": true
  },
  "conformance_examples": {
    "diagnostic_trace": {
      "record_id": "trace.scene-001.v1",
      "schema_id": "https://yuqing-cai.github.io/cn-failure-atlas/schemas/diagnostic-trace.schema.json",
      "schema_version": "2.0.0-alpha.1",
      "uri": "diagnostic-trace.example.json",
      "digest": "c431a9a3e90bc94b2d86022816fdab7157ab2ff2e9621178b174c4e503b8e052"
    },
    "repair_attempt": {
      "record_id": "repair.scene-001.v1",
      "schema_id": "https://yuqing-cai.github.io/cn-failure-atlas/schemas/repair-attempt.schema.json",
      "schema_version": "2.0.0-alpha.1",
      "uri": "repair-attempt.example.json",
      "digest": "d4b300700047185cc4fa90440947445cb0d9631ab6cb7c7fbe4cbb6e1b2b40a6"
    },
    "verification_run": {
      "record_id": "verification.scene-001.v1",
      "schema_id": "https://yuqing-cai.github.io/cn-failure-atlas/schemas/verification-run.schema.json",
      "schema_version": "2.0.0-alpha.1",
      "uri": "verification-run.example.json",
      "digest": "09bb9fc10bf15a8b5f2b6b7fe91a6ccac73d440d93302fd19ac0e22429aa06e3"
    }
  }
}
